{"corpus_id":"RRET-01","version":"0.1.1","status":"provisional-non-normative","qualifying_profiles":[],"description":"Golden adversarial retrieval corpus for separating relevance retrieval from GKOS governance eligibility and for measuring eligible-candidate recall.","invariants":["Retrieval ranking is relevance-only and must not consume GovernanceState or equivalent governance metadata.","Retrieval representations are discovery-only projections with no evidence authority.","Answer composition must quote or cite evidence objects, never RR content.","Query intent is caller-supplied; when absent, effective intent defaults to CURRENT_STATE.","Zero eligible candidates must cause expansion, abstention, or escalation; an ineligible candidate must never be substituted.","Superseded SOURCE_SCOPED evidence may be returned for inspection but must remain tagged and non-operative; L7 requires separate authorization before any effect justified by it.","Abstention volume is a quality signal. A falling abstention rate without rising eligible-candidate recall is a leakage warning."],"metrics":["False Current-State Rate (FCSR)","Eligible Candidate Recall@5","Eligible Candidate Recall@10","Eligible Candidate Recall@20","Eligible Candidate Recall@50"],"rr_generators":{"rrgen-fixture-v1":{"generator_kind":"FIXTURE_DETERMINISTIC","model_id":"none","model_version":"n/a","prompt_id":"rret-fixture-distill-v1","prompt_sha256":"56b324c6058b6a788153c31d2e530509e0b3bae74990124d47c7d5110af10b2f","software_version":"rret-01-corpus-0.1.1","regenerable":true}},"cases":[{"fixture_id":"RRET-01-N01","title":"Superseded current-state conflict","failure_class":"superseded_top_rank","query":{"text":"Where is the production database?","declared_intent":"CURRENT_STATE","effective_intent":"CURRENT_STATE","purpose":"production_operations","initial_candidate_window":5},"evidence_objects":[{"id":"db02","content":"The production database endpoint is db02.","source_content_sha256":"c92cc5eefb968559ac34d15d3172986abc150c26919dfc4c99e662aba53018b4","governance":{"disposition":"SUPERSEDED","current_state_eligible":false,"superseded_by":"db01","purpose_tags":["production_operations"],"authorization":"GENERAL"},"rr":{"rr_id":"rr-db02-v1","text":"Where is the production database? Candidate answer: db02.","generator_ref":"rrgen-fixture-v1","rr_content_sha256":"0c2756c6d50120e9360f0416f3fb238e63fbc7c5c3a2b4b24001b46ace5aef9d"}},{"id":"db01","content":"The production database endpoint was restored to db01.","source_content_sha256":"d6d01c2aabfdd6c89a6536acba5ef73bddc1c7f7570aa618164e800f0482db94","governance":{"disposition":"CURRENT","current_state_eligible":true,"superseded_by":null,"purpose_tags":["production_operations"],"authorization":"GENERAL"},"rr":{"rr_id":"rr-db01-v1","text":"Where is the production database now? Candidate answer: db01.","generator_ref":"rrgen-fixture-v1","rr_content_sha256":"cac0a5b9e168476c7c2e7e5ede29a02fe03718c0302aeea44527f068eb9b4251"}}],"raw_retrieval":[{"rank":1,"evidence_id":"db02","rr_id":"rr-db02-v1","score":0.94},{"rank":2,"evidence_id":"db01","rr_id":"rr-db01-v1","score":0.81}],"expected":{"raw_top_evidence_id":"db02","eligible_evidence_ids":["db01"],"action":"ANSWER","answer_evidence_ids":["db01"],"answer_content_source":"EVIDENCE_OBJECT","final_effect":"PERMIT","required_receipts":[],"notes":"Governance must change the operative answer without changing raw retrieval order."}},{"fixture_id":"RRET-01-N02","title":"Withdrawn high-similarity policy","failure_class":"withdrawn_top_rank","query":{"text":"What retention period applies to incident artifacts?","declared_intent":"CURRENT_STATE","effective_intent":"CURRENT_STATE","purpose":"security_operations","initial_candidate_window":5},"evidence_objects":[{"id":"retention-v1","content":"Incident artifacts are retained for 30 days.","source_content_sha256":"c9660d916cffe7d961d0459fc30278fea574de9c464cd7fd295454807c371531","governance":{"disposition":"WITHDRAWN","current_state_eligible":false,"superseded_by":"retention-v2","purpose_tags":["security_operations"],"authorization":"GENERAL"},"rr":{"rr_id":"rr-ret-v1","text":"How long are incident artifacts retained? 30 days.","generator_ref":"rrgen-fixture-v1","rr_content_sha256":"9000983e86e5a8f9d16403198c95861d4486501aaebe415de3b3b4243d7ecf0a"}},{"id":"retention-v2","content":"Incident artifacts are retained for 90 days.","source_content_sha256":"b5266b07966944ba2a551dbf3801faa36a2afded86e6c8402d92c2ca196f9350","governance":{"disposition":"CURRENT","current_state_eligible":true,"superseded_by":null,"purpose_tags":["security_operations"],"authorization":"GENERAL"},"rr":{"rr_id":"rr-ret-v2","text":"Current incident artifact retention period: 90 days.","generator_ref":"rrgen-fixture-v1","rr_content_sha256":"f6d499e392e291604e97bf15f9484d7749d3c4eb6c84d51863965c5535d15fc4"}}],"raw_retrieval":[{"rank":1,"evidence_id":"retention-v1","rr_id":"rr-ret-v1","score":0.97},{"rank":2,"evidence_id":"retention-v2","rr_id":"rr-ret-v2","score":0.78}],"expected":{"raw_top_evidence_id":"retention-v1","eligible_evidence_ids":["retention-v2"],"action":"ANSWER","answer_evidence_ids":["retention-v2"],"answer_content_source":"EVIDENCE_OBJECT","final_effect":"PERMIT","required_receipts":[]}},{"fixture_id":"RRET-01-N03","title":"Conflicting witnesses without adjudication","failure_class":"unresolved_conflict","query":{"text":"Did the failover complete successfully?","declared_intent":"CURRENT_STATE","effective_intent":"CURRENT_STATE","purpose":"incident_response","initial_candidate_window":5},"evidence_objects":[{"id":"witness-a","content":"The failover completed successfully at 14:03.","source_content_sha256":"f2df4263b3bb1f1db0833c689acbb712240d369bc829e0304314cb4faefcaebd","governance":{"disposition":"CONFLICTING","current_state_eligible":false,"superseded_by":null,"purpose_tags":["incident_response"],"authorization":"GENERAL"},"rr":{"rr_id":"rr-wa","text":"Did failover succeed? Yes, completed at 14:03.","generator_ref":"rrgen-fixture-v1","rr_content_sha256":"9cd869ec45d0c14cb5fe94ebd712ff3fc4722683af81b691d1ad9ada0ddf1074"}},{"id":"witness-b","content":"The failover did not complete; service remained on the primary node.","source_content_sha256":"bfe2ae1977d8764bfaf2a093ec86c96058a2619b73234de6ff88c987f5fb28a7","governance":{"disposition":"CONFLICTING","current_state_eligible":false,"superseded_by":null,"purpose_tags":["incident_response"],"authorization":"GENERAL"},"rr":{"rr_id":"rr-wb","text":"Did failover succeed? No, service stayed primary.","generator_ref":"rrgen-fixture-v1","rr_content_sha256":"d080e522a678d24e0da908d47b410fdf1772d48ce093ed5f0334a83e859263ec"}}],"raw_retrieval":[{"rank":1,"evidence_id":"witness-a","rr_id":"rr-wa","score":0.91},{"rank":2,"evidence_id":"witness-b","rr_id":"rr-wb","score":0.89}],"expected":{"raw_top_evidence_id":"witness-a","eligible_evidence_ids":[],"action":"ABSTAIN_OR_ESCALATE","answer_evidence_ids":[],"answer_content_source":"NONE","final_effect":"DENY","required_receipts":[],"human_to_do":"Adjudicate conflicting failover witnesses before current-state use."}},{"fixture_id":"RRET-01-N04","title":"Purpose-bound candidate outranks purpose-compatible evidence","failure_class":"purpose_mismatch","query":{"text":"Which recovery procedure should production operations use?","declared_intent":"CURRENT_STATE","effective_intent":"CURRENT_STATE","purpose":"production_operations","initial_candidate_window":5},"evidence_objects":[{"id":"runbook-training","content":"Training recovery procedure: reset the simulator and reseed synthetic state.","source_content_sha256":"73abacc691928a74a8771b71b901e80be5cffd13ebd98106722bfa948734a31d","governance":{"disposition":"CURRENT","current_state_eligible":true,"superseded_by":null,"purpose_tags":["training"],"authorization":"GENERAL"},"rr":{"rr_id":"rr-training","text":"Recovery procedure: reset and reseed state.","generator_ref":"rrgen-fixture-v1","rr_content_sha256":"c59ba8ead0df28303ee0717cc70ee9a7b12a0c7775c72c0b2d73f021d9ca1970"}},{"id":"runbook-prod","content":"Production recovery procedure: fail over to the warm replica and verify receipts before resuming writes.","source_content_sha256":"24d6e9e964ddf3e02065f86264dc18870902d1078d13f46ea43b0131c0a9eeed","governance":{"disposition":"CURRENT","current_state_eligible":true,"superseded_by":null,"purpose_tags":["production_operations"],"authorization":"GENERAL"},"rr":{"rr_id":"rr-prod","text":"Production recovery procedure: fail over to warm replica, verify receipts, resume writes.","generator_ref":"rrgen-fixture-v1","rr_content_sha256":"6a1e388d6f299fadd33638aa17c45a9fa76db1bee5cf43d9248f1c02cde0da67"}}],"raw_retrieval":[{"rank":1,"evidence_id":"runbook-training","rr_id":"rr-training","score":0.93},{"rank":2,"evidence_id":"runbook-prod","rr_id":"rr-prod","score":0.84}],"expected":{"raw_top_evidence_id":"runbook-training","eligible_evidence_ids":["runbook-prod"],"action":"ANSWER","answer_evidence_ids":["runbook-prod"],"answer_content_source":"EVIDENCE_OBJECT","final_effect":"PERMIT","required_receipts":[]}},{"fixture_id":"RRET-01-N05","title":"Source-scoped superseded evidence remains inspectable but non-operative","failure_class":"source_scoped_superseded","query":{"text":"What does db02 say?","declared_intent":"SOURCE_SCOPED","effective_intent":"SOURCE_SCOPED","purpose":"audit","source_scope":["db02"],"initial_candidate_window":5},"evidence_objects":[{"id":"db02","content":"The production database endpoint is db02.","source_content_sha256":"c92cc5eefb968559ac34d15d3172986abc150c26919dfc4c99e662aba53018b4","governance":{"disposition":"SUPERSEDED","current_state_eligible":false,"superseded_by":"db01","purpose_tags":["audit","production_operations"],"authorization":"GENERAL"},"rr":{"rr_id":"rr-db02-v1","text":"What does db02 say? Production database endpoint is db02.","generator_ref":"rrgen-fixture-v1","rr_content_sha256":"5a4257c7a31681ccc16f4696dca1c5009de474db9fe4f41242f97aefce9b21d5"}},{"id":"db01","content":"The production database en